{
  "authoritative_tree_edited": false,
  "mutation_id": "replace-add-with-subtract",
  "schema_version": "1.0",
  "semantic_authority": "NONE",
  "status": "APPLIED_TO_DISPOSABLE_COPY",
  "touched_files": [
    {
      "after_sha256": "0cf6d931e90565dab260b193814aa11811d9795c64c8872dcb7e82dd5fea7b1e",
      "after_size_bytes": 82,
      "before_sha256": "3c9ac55f99ea58218cb9fa90428ba9c79e48ed2456681c6618851cefb62df191",
      "before_size_bytes": 82,
      "hunk_count": 1,
      "path": "src/math_ops.c"
    }
  ]
}
